{
  "schemaVersion": 1,
  "capturedAt": "2026-08-31",
  "purpose": "dsh-plugin-alpha2-static-migration-evidence",
  "baseline": {
    "tag": "dsh-v0.1.2-alpha.2",
    "commit": "0a53fb55bea101816fa226bb964ae2bed71c343b",
    "tree": "64ccbfa8e0caa4711cd4a75717ef9e022657961b",
    "removedPackages": [
      "@deepseek-ai/dsh-client-runtime",
      "@deepseek-ai/dsh-host-apiproxy"
    ]
  },
  "awesomeSnapshot": {
    "repository": "https://github.com/awesome-dsh-plugin/awesome-dsh-plugin.git",
    "commit": "db181e1aed39ad4a041cb9d379f0d713edfc49bb",
    "tree": "24c75117d9fe59fd832359c7ef2ab14632fd543d"
  },
  "publication": {
    "status": "static-reviewed-pending-runtime",
    "installable": false,
    "runtimeCertifiedCount": 0
  },
  "counts": {
    "reviewedRejected": 44,
    "directPinRetained": 6,
    "hostedAdaptationRetained": 10,
    "retired": 28,
    "replacementCandidates": 44,
    "replacementDirectUpstream": 35,
    "replacementHostedAdaptation": 9
  },
  "idPolicy": {
    "firstEligibleReplacementCatalogId": 3089,
    "idsToIssueAfterCertification": 28,
    "allocateOnlyAfterSixTaskRuntimePass": true,
    "neverRebindRetiredIds": true,
    "candidatePublicIdsAllocated": false
  },
  "directPinRetained": [
    {
      "catalogId": 3021,
      "repository": "https://github.com/PerryLink/dsh-mcp-panel.git",
      "commit": "cb98f2749845be5dfcb0fdc84e7c296a95677bcd",
      "tree": "0a7a3a8d3aa0050dd98fb70b30eaa2e832faa8c1",
      "packageCoordinate": "dsh-mcp-panel@0.6.2",
      "decision": "retain-direct-pin",
      "staticReviewStatus": "static-reviewed",
      "runtimeStatus": "pending-runtime",
      "reasonCodes": ["alpha2-surface-clean"]
    },
    {
      "catalogId": 3022,
      "repository": "https://github.com/PerryLink/dsh-session-pin.git",
      "commit": "118fbc0aad229c7879d0cc890646b04fce91f859",
      "tree": "17be9f155bd93bca4a824a0ad68281ed8c067874",
      "packageCoordinate": "dsh-session-pin@0.7.0",
      "decision": "retain-direct-pin",
      "staticReviewStatus": "static-reviewed",
      "runtimeStatus": "pending-runtime",
      "reasonCodes": ["alpha2-surface-clean"]
    },
    {
      "catalogId": 3032,
      "repository": "https://github.com/bowenliang123/dsh-context.git",
      "commit": "115e183de0c264c75fb6dd0e184a99d1caeffbac",
      "tree": "ef0a4f074d1b0ec86454bbc38eddaccffb228d02",
      "packageCoordinate": "dsh-context@0.38.5",
      "decision": "retain-direct-pin",
      "staticReviewStatus": "static-reviewed",
      "runtimeStatus": "pending-runtime",
      "reasonCodes": ["alpha2-surface-clean"]
    },
    {
      "catalogId": 3039,
      "repository": "https://github.com/omdsh-dev/DSH-better-sidebar.git",
      "commit": "d70db8fb026d002b22ae97efd893ff08ee9f0d10",
      "tree": "1a7696e3ea02713c214e6d8081349081dbcf2f4b",
      "packageCoordinate": "dsh-better-sidebar@0.18.0-alpha.0",
      "decision": "retain-direct-pin",
      "staticReviewStatus": "static-reviewed",
      "runtimeStatus": "pending-runtime",
      "reasonCodes": ["alpha2-surface-clean"]
    },
    {
      "catalogId": 3066,
      "repository": "https://github.com/omdsh-dev/dsh-llm-fallbacks.git",
      "commit": "ea55abb205b3811329f859d85a44fd630de59e01",
      "tree": "6c82c106aad60e7b472a5fb8b6cf2bdf3403739a",
      "packageCoordinate": "dsh-llm-fallbacks@0.4.0-alpha.1",
      "decision": "retain-direct-pin",
      "staticReviewStatus": "static-reviewed",
      "runtimeStatus": "pending-runtime",
      "reasonCodes": ["alpha2-surface-clean"]
    },
    {
      "catalogId": 3076,
      "repository": "https://github.com/NanmiCoder/dsh-agent-teams.git",
      "commit": "232a338fc9a0d393f118912386f67e7f3a6c67d6",
      "tree": "b86bb07df0d5a109d0db2f9498233c8a7741c90a",
      "packageCoordinate": "@nanmicoder/dsh-agent-teams@0.1.15",
      "decision": "retain-direct-pin",
      "staticReviewStatus": "static-reviewed",
      "runtimeStatus": "pending-runtime",
      "reasonCodes": ["alpha2-surface-clean"]
    }
  ],
  "hostedAdaptationRetained": [
    {
      "catalogId": 3004,
      "repository": "https://github.com/0xsline/dsh-spotlight.git",
      "commit": "b3565e8629d9a393d764681e96f4c41100cc12fa",
      "tree": "f5310d52bb46ad62acb33374e3b17efe32848fcc",
      "packageCoordinate": "@0xsline/dsh-spotlight@0.0.2",
      "decision": "retain-hosted-adaptation",
      "staticReviewStatus": "static-reviewed",
      "runtimeStatus": "pending-runtime",
      "reasonCodes": ["removed-client-runtime-import", "hosted-rewrite-bounded"]
    },
    {
      "catalogId": 3006,
      "repository": "https://github.com/Khellendros97/dsh-better-model-selector.git",
      "commit": "4781f4c215f1ad4d55a44e1409bafe58f05b721f",
      "tree": "8840140ed08a525005e3468348e8d5370416e371",
      "packageCoordinate": "dsh-better-model-selector@1.0.0",
      "decision": "retain-hosted-adaptation",
      "staticReviewStatus": "static-reviewed",
      "runtimeStatus": "pending-runtime",
      "reasonCodes": ["removed-client-runtime-import", "hosted-rewrite-bounded"]
    },
    {
      "catalogId": 3008,
      "repository": "https://github.com/NigelYao/dsh-view-modes.git",
      "commit": "a57d237e03b6488875cb7cc2a90bf6a37512632d",
      "tree": "5f84cf31a180a1aced2496e8e391f0751d836e41",
      "packageCoordinate": "dsh-view-modes@1.0.0",
      "decision": "retain-hosted-adaptation",
      "staticReviewStatus": "static-reviewed",
      "runtimeStatus": "pending-runtime",
      "reasonCodes": ["removed-client-runtime-import", "hosted-rewrite-bounded"]
    },
    {
      "catalogId": 3010,
      "repository": "https://github.com/ZSeven-W/dsh-openpencil.git",
      "commit": "99e05cdbae5e26c920cc20e0793c66446685b0cd",
      "tree": "6c20cfaf67190014bca428b65f9f27bc16b3bae7",
      "packageCoordinate": "@zseven-w/dsh-openpencil@0.1.0-rc.9",
      "decision": "retain-hosted-adaptation",
      "staticReviewStatus": "static-reviewed",
      "runtimeStatus": "pending-runtime",
      "reasonCodes": ["removed-client-runtime-import", "hosted-rewrite-bounded"]
    },
    {
      "catalogId": 3011,
      "repository": "https://github.com/GooodWei/arcana.git",
      "commit": "82f910c0b5e645c65c2a34be0b0e47035d0489a7",
      "tree": "36cb0b3210b87a8c57d9d13845d8b1564842b126",
      "packageCoordinate": "arcana@0.1.0",
      "decision": "retain-hosted-adaptation",
      "staticReviewStatus": "static-reviewed",
      "runtimeStatus": "pending-runtime",
      "reasonCodes": ["removed-client-runtime-import", "hosted-rewrite-bounded"]
    },
    {
      "catalogId": 3017,
      "repository": "https://github.com/yibiner/dsh-plugin-list-plus.git",
      "commit": "f62e6ba7be47f42accae372bb84dc879972d071a",
      "tree": "8fa40ba5c5f3ba78a54db05a39487b4a79a81f34",
      "packageCoordinate": "dsh-plugin-list-plus@0.1.0",
      "decision": "retain-hosted-adaptation",
      "staticReviewStatus": "static-reviewed",
      "runtimeStatus": "pending-runtime",
      "reasonCodes": ["removed-client-runtime-import", "hosted-rewrite-bounded"]
    },
    {
      "catalogId": 3040,
      "repository": "https://github.com/Ericwong5021/dsh-kanban.git",
      "commit": "f7fa24c14db47ee4827cad5c827ad7aa3fd13434",
      "tree": "322fe7f98155d8cee98918f235ce4602ffe3cbc3",
      "packageCoordinate": "dsh-kanban@0.1.1",
      "decision": "retain-hosted-adaptation",
      "staticReviewStatus": "static-reviewed",
      "runtimeStatus": "pending-runtime",
      "reasonCodes": ["removed-client-runtime-import", "hosted-rewrite-bounded"]
    },
    {
      "catalogId": 3041,
      "repository": "https://github.com/GooodWei/context-vista.git",
      "commit": "fdde2e6da8524cd5ea27598c19eae744d4a1078a",
      "tree": "1dcfc8e5952365ec142eafcc6ddd007e0b6fb6b5",
      "packageCoordinate": "context-vista@0.1.0",
      "decision": "retain-hosted-adaptation",
      "staticReviewStatus": "static-reviewed",
      "runtimeStatus": "pending-runtime",
      "reasonCodes": ["removed-client-runtime-import", "hosted-rewrite-bounded"]
    },
    {
      "catalogId": 3042,
      "repository": "https://github.com/zhaoscsc/dsh-wikilink.git",
      "commit": "7f0203b6690588f30b7a9a35af37c1978a7caacc",
      "tree": "aefb3d89dd6dffb9b3a0b5b43adfbbe6a1c5b4e3",
      "packageCoordinate": "dsh-wikilink@0.2.0",
      "decision": "retain-hosted-adaptation",
      "staticReviewStatus": "static-reviewed",
      "runtimeStatus": "pending-runtime",
      "reasonCodes": ["removed-client-runtime-import", "hosted-rewrite-bounded"]
    },
    {
      "catalogId": 3050,
      "repository": "https://github.com/titanwings/dsh-automation.git",
      "commit": "b0c1a6a10bd47b6cb54dd1090311347537e0a3ea",
      "tree": "04d3f5a09ac3dcefa27531b655b0b78161720358",
      "packageCoordinate": "@dsh-external/dsh-automation@0.1.7",
      "decision": "retain-hosted-adaptation",
      "staticReviewStatus": "static-reviewed",
      "runtimeStatus": "pending-runtime",
      "reasonCodes": ["removed-client-runtime-import", "hosted-rewrite-bounded"]
    }
  ],
  "retired": [
    {
      "catalogId": 3009,
      "repository": "https://github.com/Laplace-bit/dsh-smooth-stream.git",
      "commit": "adebd1964b30b6c1e8821cc92fb4a870ffe98d0c",
      "tree": "bd9c16257d5218ed4c67fbab96baec78da55a40c",
      "packageCoordinate": "dsh-smooth-stream@0.4.1",
      "decision": "retire-permanently",
      "staticReviewStatus": "static-reviewed",
      "runtimeStatus": "pending-runtime",
      "reasonCodes": ["removed-client-runtime-import", "retirement-selected"]
    },
    {
      "catalogId": 3012,
      "repository": "https://github.com/GitHubJiKe/dsh-markdown-preview.git",
      "commit": "f63cdf45b814eb56b7fb33c5744686baaea1550f",
      "tree": "a691ebd7a6c92a1afda3720c84b6978de649c43c",
      "packageCoordinate": "dsh-markdown-preview@0.3.0",
      "decision": "retire-permanently",
      "staticReviewStatus": "static-reviewed",
      "runtimeStatus": "pending-runtime",